NO,ENGGANO,IN_FLEX,INCLUDE,POS,PHONEME,PHONEME_SEGMENT,SENSE_ID,VARIANT,VARIANT_PHONEME,VARIANT_PHONEME_SEGMENT,MAIN_ENTRY,MAIN_ENTRY_IDN,MAIN_ENTRY_EN,CROSSREF,INDONESIAN,ENGLISH,NOTES_EN,NOTES_ID,GAMBAR,URL
206,pėkã po,y,TRUE,n,pəkã po,p ə k ã # p o,,,,,pėkã,pelepah/seludung,spathe,,pelepah/seludung kelapa,coconut spathe,,,,
207,yumu yi'kėh,,TRUE,n,jumu jiʔkəh,j u m u # j i ʔ k ə h,,,,,,,,,pohon berdaun lebar yang daunnya seringkali digunakan masyarakat Enggano oleh masyarakat Enggano sebagai penutup bagian perut penyu setelah dibersihkan,A broad-leaved tree whose leaves are often used by the Enggano people to cover the cleaned belly of turtles,,,,
208,ku harah,,TRUE,n,ku harah,k u # h a r a h,,,,,ku,kayu,wood,,kayu harah atau kayu hutan tumbuh di pesisir pantai yang daunnya digunakan sebagai obat Malaria,"Harah wood or forest wood growing on the coast, with leaves used as a malaria remedy",,,,
209,kanim,,TRUE,n,kanim,k a n i m,,,,,,,,,tanaman perdu yang daunnya digunakan sebagai racun organik dalam menangkap ikan,A shrub whose leaves are used as an organic poison to catch fish,,,,
210,yakãkã,,TRUE,n,jakãkã,j a k ã k ã,,,,,,,,,beringin pantai memiliki akar gantung dengan daun kecil,Coastal fig trees with hanging roots and small leaves,,,,
211,yėp akoma',,TRUE,n,jəp akomaʔ,j ə p # a k o m a ʔ,,,,,yė̃p,rumput,grass,,jenis rumput liar berakar serabut dan memiliki sistem geragih dalam perkembangbiakkannya. Rumput ini memiliki fungsi sebagai obat penangkal racun chilopoda seperti kelabang,"A type of wild grass with fibrous roots and a stolon system in its growth, functioning as an antidote for centipede venom",,,,
212,kuni' bonglai,,TRUE,n,kuniʔ boŋlaj,k u n i ʔ # b o ŋ l a j,,,,,kuyit,kunyit,turmeric,,"tumbuhan akar rimpang yang memiliki umbi seperti kunyit pada umumnya, tetapi digunakan sebagai penagkal roh jahat dalam kepercayaan masyarakat Enggano","A rhizome plant with turmeric-like roots, traditionally believed by the Enggano people to ward off evil spirits",,,,
213,kinamaki,,TRUE,n,kinamaki,k i n a m a k i,,,,,,,,,"tanaman perdu yang tumbuh di hutan, memiliki bunga merah dan berkhasiat sebagai obat sesak napas",A shrub in the forest with red flowers that serve as a remedy for shortness of breath,,,,
214,pi'yeh,,TRUE,n,piʔjeh,p i ʔ j e h,,,,,,,,,tanaman perdu memiliki bunga putih keunguan serta buah yang berwarna ungu tua ketika matang,A shrub with purple-white flowers and dark purple fruit when ripe,,,,
215,hori,,TRUE,n,hori,h o r i,,,,,,,,,tanaman perdu yang ada di hutan Enggano yang bermanfaat dalam pengobatan hordeolum atau bintil mata,A shrub in the Enggano forest beneficial for treating hordeolum or eye styes,,,,
216,kuni' iė',,TRUE,n,kuniʔ jiəʔ,k u n i ʔ # j i ə ʔ,,,,,kuyit,kunyit,turmeric,,kunyit atau kunir (Curcuma longa Linn. syn. Curcuma domestica Val.),"Turmeric or kunyit (Curcuma longa Linn., syn. Curcuma domestica Val.)",,,,
217,yara',,TRUE,n,jaraʔ,j a r a ʔ,,,,,,,,,jarak,Castor plant,,,,
218,ku neh,,TRUE,n,ku neh,k u # n e h,,,,,ku,kayu,wood,,jenis kayu hutan yang seringkali digunakan oleh masyarakat Enggano sebagai tanaman pagar,A type of forest wood often used by the Enggano people as fencing plants,,,,
219,yėp kanokeh,,TRUE,n,jəp kanokeh,j ə p # k a n o k e h,,,,,yė̃p,rumput,grass,,jenis rumput liar yang memiliki daun kecil dan bunga berwarna putih dan ungu,A type of wild grass with small leaves and white-purple flowers,,,,
220,udėp ka'kėh,,TRUE,n,udəp kaʔkəh,u d ə p # k a ʔ k ə h,,,,,udėp,talas,taro,,keladi hitam,Black taro,,,,
221,udėp eo,,TRUE,n,udəp eɔ,u d ə p # e ɔ,,,,,udėp,talas,taro,,keladi hijau yang dapat dijadikan bahan masakan/keladi rawah,"Green taro, which can be used as cooking ingredients",,,,
222,kahũk,,TRUE,n,kahũk,k a h ũ k,,,,,,,,,pandan wangi,Fragrant pandan,,,,
223,eyãp kakuni',,TRUE,n,ejãp kakuniʔ,e j ã p # k a k u n i ʔ,,,,,yẽãp,akar,root,,akar kuning,yellow root,,,,
224,apua kahuroro,,TRUE,n,apuwa kahuroro,a p u w a # k a h u r o r o,,,,,yẽãp,akar,root,,jenis pohon apua,kind of apua tree,,,,
225,ku aro'or,,TRUE,n,ku aroʔor,k u # a r o ʔ o r,,,,,ku,kayu,wood,,Jenis kayu hutan berdaun lebar,Broad-leaved forest wood species,,,,
226,ba'au kerutu',y,TRUE,n,baʔaw kerutuʔ,b a ʔ a w # k e r u t u ʔ,,,,,ba'au,jambu,guava,,jambu biji,guava,,,,
227,cokla',,TRUE,n,t͡ʃoklaʔ,t͡ʃ o k l a ʔ,,,,,,,,,coklat,cacao,,,,
228,eiob-eiob,,TRUE,n,ejob-ejob,e j o b - e j o b,,,,,,,,,kayu hutan berdaun lebar dan memiliki batang lurus,forest wood with broad leaves and having a straight trunk,,,,
229,it kėpo',,TRUE,n,it kəpoʔ,i t # k ə p o ʔ,,,,,it,pisang,banana,,pisang kepok,kepok banana,,,,
230,ka'pã,,TRUE,n,kaʔpã,k a ʔ p ã,,,,,,,,,jerangau,Acorus calamus,,,,
231,hĩũ ki'ion,,TRUE,n,hiũ kiʔjon,h i ũ # k i ʔ j o n,,,,,hĩũ,buah,fruit,,buah pohon ki'yon,the fruit of “ki'yon” tree,,,,
232,kahimėk,,TRUE,n,kahimək,k a h i m ə k,,,,,,,,,,,,,,
233,ku kari'ėr,,TRUE,n,kariʔər,k a r i ʔ ə r,,,,,ku,kayu,wood,kari'iė,"jenis kayu hutan yang batangnya digunakan sebagai tombak, gagang kampak, dan lain sebagainya.","a type of forest wood whose stems are used as spears, axe handles, and so on.",,,,
234,kei' ku,,TRUE,n,keiʔ ku,k e i ʔ # k u,,,,,,,,,ubi hutan,forest yam,,,,
235,kėsendet,,TRUE,n,kəsendet,k ə s e n d e t,,,,,,,,,ciplukan,Physalis Angulata,,,,
236,kida'aur,,TRUE,n,kidaʔaur,k i d a ʔ a u r,,,,,,,,,jenis kayu hutan,forest wood species,,,,
237,ku dai',,TRUE,n,kudaiʔ,k u d a i ʔ,,,,,ku,kayu,wood,,jenis kayu hutan,forest wood species,,,,
238,ku ema,,TRUE,n,ku ema,k u # e m a,,,,,ku,kayu,wood,,jenis kayu hutan,forest wood species,,,,
239,iėr,,TRUE,n,jər,j ə r,,,,,,,,,mengkudu,pace,,,,
240,kũã'ãu,,FALSE,n,kũãʔãw,k ũ ã ʔ ã w,,,,,,,,,kayu hutan,forest wood,,,,
241,kurur,,TRUE,n,kurur,k u r u r,,,,,,,,,kundur,the wax gourd (Benincasa hispida),,,,
242,kuni' bed,y,TRUE,n,kuniʔ bed,k u n i ʔ # b e d,,,,,kuyit,kunyit,turmeric,,kunyit/temulawak,turmeric,,,,
243,pakihiėp,,FALSE,n,pakihiəp,p a k i h i ə p,,,,,,,,,tanaman perdu yang digunakan sebagai pakaian adat dalam tari perang,shrubs used as traditional clothing in war dance,,,,
244,pė'ėa' yi'i,,TRUE,n,pəʔəaʔ jiʔi,p ə ʔ ə a ʔ # j i ʔ i,,,,,pu'a,rotan kasar,large rattan pieces,,Rotan Sanjat (Calamus paspalanthus Beccari),a kind of rattan,,,,
245,pė'ėa',,TRUE,n,pəʔəaʔ,p ə ʔ ə a ʔ,,,,,,,,,Rotan Balubuk (Calamus burckianus Beccari),a kind of rattan,,,,
246,pė'ėa' kĩhĩ,,TRUE,n,pəʔəaʔ kihi,p ə ʔ ə a ʔ # k i h i,,,,,kĩhĩ,rotan halus; rotan cacing; Rotan Seuti (Calamus ornatus Blume),small pieces of rattan; warm rattan,,Rotan Seuti (Calamus ornatus Blume),a kind of rattan,,,,
247,pėk,y,TRUE,n,pək,p ə k,,,,,,,,,jenis kayu hutan,forest wood species,,,,
248,pi' kėh,,TRUE,n,piʔkəh,p i ʔ k ə h,,,,,,,,,jenis kayu hutan,forest wood species,,,,
249,siri-siri,,TRUE,n,siri-siri,s i r i - s i r i,,,,,,,,,jenis tanaman hutan,forest plant species,,,,
250,yėhė,,TRUE,n,jəhə,j ə h ə,,,,,,,,,jenis kayu hutan,forest wood species,,,,
251,yohob,y,TRUE,n,johob,j o h o b,,,,,,,,,jenis kayu hutan,forest wood species,,,,
252,ku ki'ion,,TRUE,n,ku kiʔion,k u # k i ʔ i o n,,,,,ku,kayu,wood,hĩũ ki'ion,jenis kayu hutan,forest wood species,,,,
